{
  "title": "Quiz Title",
  "description": "Brief description of what this quiz tests",
  "type": "multiple-choice",
  "difficulty": "beginner",
  "timeLimit": 300,
  "passingScore": 70,
  "questions": [
    {
      "question": "What does 'hola' mean in English?",
      "type": "multiple-choice",
      "options": [
        "goodbye",
        "hello",
        "thank you",
        "please"
      ],
      "correctAnswer": "hello",
      "explanation": "'Hola' is the most common Spanish greeting meaning 'hello'.",
      "hints": ["Think about common greetings"],
      "points": 1
    },
    {
      "question": "Translate: 'Good morning' to Spanish",
      "type": "fill-in-blank",
      "correctAnswer": "buenos días",
      "explanation": "'Buenos días' is used to greet someone in the morning.",
      "points": 2
    }
  ]
}